{
  "schemaVersion": 4,
  "kind": "DASHBOARD_WIDGET_RESULT",
  "widgetResult": {
    "widgetId": "50000000-0000-4000-8000-000000000001",
    "resultState": "READY",
    "rows": [
      {
        "label": "Doanh thu",
        "displayValue": "42 VND",
        "numericValue": 42,
        "unit": "VND",
        "provenance": {
          "resultCellId": "50000000-0000-4000-8000-000000000005",
          "planVersionId": "50000000-0000-4000-8000-000000000002",
          "metricVersionId": "50000000-0000-4000-8000-000000000003",
          "datasetVersionId": "50000000-0000-4000-8000-000000000004",
          "evidenceRefs": ["50000000-0000-4000-8000-000000000006"]
        }
      }
    ]
  },
  "subjectBindings": {
    "dashboardId": "50000000-0000-4000-8000-000000000007",
    "dashboardVersionId": "50000000-0000-4000-8000-000000000008",
    "widgetId": "50000000-0000-4000-8000-000000000001",
    "planVersionId": "50000000-0000-4000-8000-000000000002",
    "metricVersionId": "50000000-0000-4000-8000-000000000003",
    "datasetVersionId": "50000000-0000-4000-8000-000000000004",
    "permissionProjectionVersionId": "50000000-0000-4000-8000-000000000009",
    "policyVersionId": "50000000-0000-4000-8000-000000000010",
    "locale": "vi-VN",
    "timezone": "Asia/Ho_Chi_Minh",
    "inputSelectorHash": "aaaaaaaaaaaaaaaaaaaaaaaaaaaaaaaaaaaaaaaaaaaaaaaaaaaaaaaaaaaaaaaa",
    "engineVersion": "0.1.0",
    "handlerDigest": "sha256:bbbbbbbbbbbbbbbbbbbbbbbbbbbbbbbbbbbbbbbbbbbbbbbbbbbbbbbbbbbbbbbb"
  }
}
